{
  "$schema": "http://json-schema.org/draft-07/schema#",
  "type": "array",
  "items": {
    "type": "object",
    "properties": {
      "id": {
        "type": "string",
        "minLength": 1
      },
      "date": {
        "type": "string",
        "pattern": "^\\d{4}-\\d{2}-\\d{2}$"
      },
      "status": {
        "type": "string",
        "enum": [
          "upcoming",
          "past"
        ]
      },
      "speaker": {
        "type": "string",
        "minLength": 1
      },
      "speaker_position": {
        "type": "string",
        "minLength": 1
      },
      "affiliation": {
        "type": "string",
        "minLength": 1
      },
      "start_time": {
        "type": "string",
        "pattern": "^\\d{2}:\\d{2}$"
      },
      "location": {
        "type": "string",
        "minLength": 1
      },
      "title": {
        "type": "string",
        "minLength": 1
      },
      "abstract": {
        "type": "string"
      },
      "paper_link": {
        "type": "string",
        "format": "uri"
      },
      "notes": {
        "type": "string"
      },
      "academic_year": {
        "type": "string",
        "pattern": "^\\d{4}-\\d{4}$"
      }
    },
    "required": [
      "id",
      "date",
      "status",
      "speaker",
      "title"
    ],
    "additionalProperties": false
  }
}
