[
  {
    "speaker": "Federico Huxhagen",
    "speaker_position": "Licenciado",
    "affiliation": "DF-IFIBA UBA-CONICET",
    "title": "Búsqueda de materia oscura ultraliviana a través de datos de temporización de púlsares binarios",
    "abstract": "Si la materia oscura está compuesta por bosones ultralivianos, puede comportarse como un campo oscilante capaz de perturbar las órbitas de púlsares binarios. Esas perturbaciones modifican los tiempos de llegada de los pulsos a la Tierra y pueden amplificarse cuando la frecuencia del campo entra en resonancia con la órbita. En esta charla presentaré una búsqueda de estas señales en los datos de temporización de 50 púlsares binarios de NANOGrav. Consideramos acoplamientos lineales y cuadráticos de un campo escalar a la materia, así como un campo vectorial. A partir de estos datos, obtenemos cotas sobre la intensidad de los distintos acoplamientos en un amplio rango de masas. Finalmente, compararé los resultados con los de otras búsquedas y discutiré qué aportan los púlsares binarios al estudio de la materia oscura ultraliviana.",
    "id": "2026-10-05-federico-huxhagen",
    "date": "2026-10-05",
    "status": "past",
    "academic_year": "2026-2027",
    "start_time": "15:00",
    "location": "Aula Federman",
    "paper_link": "https://arxiv.org/abs/2604.26092"
  },
  {
    "speaker": "Tomas Chase",
    "speaker_position": "PhD",
    "affiliation": "IFIBA",
    "title": "El evento de 248 keV en LZ y la búsqueda de WIMPs",
    "abstract": "En esta charla nos centraremos en el evento de alta energía observado recientemente por la colaboración LUX-ZEPLIN (LZ), presentado en arXiv:2609.02823. Utilizaremos este resultado como punto de partida para introducir cómo pueden describirse las interacciones entre WIMPs y núcleos mediante una teoría efectiva de campos. Luego discutiremos el funcionamiento y la calibración del experimento LZ, así como la reconstrucción del evento observado. Finalmente, revisaremos el análisis de los datos, sus principales fuentes de fondo y qué conclusiones pueden extraerse acerca de la posible naturaleza de este evento.",
    "id": "2026-09-14-tomas-chase",
    "date": "2026-09-14",
    "status": "past",
    "academic_year": "2026-2027",
    "start_time": "15:00",
    "location": "Aula Federman",
    "paper_link": "https://arxiv.org/abs/2609.02823"
  }
]
